{
  "schemaVersion": "1.0.0",
  "minimumRendererVersion": 1,
  "requiredFeatures": [
    "layout.single",
    "layout.split2",
    "panel.flip",
    "shot.close",
    "scene.template",
    "text.typewriter"
  ],
  "project": {
    "id": "zayavka-v1",
    "title": "Как могло бы проходить рассмотрение заявки",
    "language": "ru-RU",
    "targetDurationSeconds": 160,
    "width": 1920,
    "height": 1080,
    "fps": 30,
    "totalDurationFrames": 4748,
    "timing": {
      "charactersPerSecond": 12,
      "preRollFrames": 12,
      "beatHoldFrames": {
        "listItem": 18,
        "acknowledgement": 24,
        "quickBeat": 30,
        "ordinary": 36,
        "punchline": 36,
        "silentReaction": 42,
        "emphasis": 48,
        "explanation": 54,
        "longExplanation": 66
      }
    }
  },
  "style": {
    "presetId": "cel-heavy-outline-01",
    "kenBurnsScale": 1
  },
  "theme": {
    "backgroundColor": "#02090b",
    "panelGutterPx": 8,
    "dialogueBarHeightPx": 300,
    "dialogueBarColor": "#030607",
    "dialogueBarBorderColor": "#536064",
    "textColor": "#f6f4ed",
    "fontFamily": "Arial, Helvetica, sans-serif"
  },
  "characters": [
    {
      "id": "anton",
      "displayName": "Антон",
      "role": "Руководитель контент-проектов",
      "traits": "Скептичный, прямой, быстро увлекается, когда понимает идею"
    },
    {
      "id": "veronika",
      "displayName": "Вероника",
      "role": "Исполнительный директор",
      "traits": "Спокойно объясняет, держит инициативу, говорит по делу"
    },
    {
      "id": "roman",
      "displayName": "Роман",
      "role": "Исполнительный директор",
      "traits": "Немногословный, вступает один раз и попадает в точку"
    }
  ],
  "expressionSheets": [
    {
      "characterId": "anton",
      "basePortraitId": "anton.weary-contempt",
      "entries": [
        {
          "id": "anton.weary-contempt",
          "label": "weary contempt",
          "descriptor": {
            "valence": "negative",
            "intensity": 2,
            "mouth": "closed",
            "gaze": "to-camera",
            "headOrientation": "three-quarter-left",
            "gesture": "none"
          },
          "suitableFor": [
            "speaking",
            "listening"
          ],
          "flipSafe": true,
          "asset": {
            "kind": "file",
            "path": "assets/real-anton-01-weary-contempt.png"
          }
        },
        {
          "id": "anton.guarded-curiosity",
          "label": "guarded curiosity",
          "descriptor": {
            "valence": "neutral",
            "intensity": 1,
            "mouth": "closed",
            "gaze": "to-camera",
            "headOrientation": "three-quarter-left",
            "gesture": "none"
          },
          "suitableFor": [
            "speaking",
            "listening"
          ],
          "flipSafe": true,
          "asset": {
            "kind": "file",
            "path": "assets/real-anton-02-guarded-curiosity.png"
          }
        },
        {
          "id": "anton.disbelieving-astonishment",
          "label": "disbelieving astonishment",
          "descriptor": {
            "valence": "negative",
            "intensity": 3,
            "mouth": "slightly-open",
            "gaze": "to-camera",
            "headOrientation": "frontal",
            "gesture": "none"
          },
          "suitableFor": [
            "speaking",
            "listening",
            "reaction"
          ],
          "flipSafe": true,
          "asset": {
            "kind": "file",
            "path": "assets/real-anton-03-disbelieving-astonishment.png"
          }
        },
        {
          "id": "anton.comic-confusion",
          "label": "comic confusion",
          "descriptor": {
            "valence": "comedic",
            "intensity": 2,
            "mouth": "slightly-open",
            "gaze": "screen-left",
            "headOrientation": "three-quarter-left",
            "gesture": "none"
          },
          "suitableFor": [
            "speaking",
            "listening"
          ],
          "flipSafe": true,
          "asset": {
            "kind": "file",
            "path": "assets/real-anton-04-comic-confusion.png"
          }
        },
        {
          "id": "anton.focused-engagement",
          "label": "focused engagement",
          "descriptor": {
            "valence": "neutral",
            "intensity": 2,
            "mouth": "closed",
            "gaze": "to-camera",
            "headOrientation": "three-quarter-left",
            "gesture": "none"
          },
          "suitableFor": [
            "speaking",
            "listening"
          ],
          "flipSafe": true,
          "asset": {
            "kind": "file",
            "path": "assets/real-anton-05-focused-engagement.png"
          }
        },
        {
          "id": "anton.evaluative-understanding",
          "label": "evaluative understanding",
          "descriptor": {
            "valence": "neutral",
            "intensity": 2,
            "mouth": "closed",
            "gaze": "to-camera",
            "headOrientation": "three-quarter-left",
            "gesture": "none"
          },
          "suitableFor": [
            "speaking",
            "listening"
          ],
          "flipSafe": true,
          "asset": {
            "kind": "file",
            "path": "assets/real-anton-06-evaluative-understanding.png"
          }
        },
        {
          "id": "anton.excited-ideation",
          "label": "excited ideation",
          "descriptor": {
            "valence": "positive",
            "intensity": 3,
            "mouth": "open-speaking",
            "gaze": "to-camera",
            "headOrientation": "frontal",
            "gesture": "none"
          },
          "suitableFor": [
            "speaking",
            "listening",
            "reaction"
          ],
          "flipSafe": true,
          "asset": {
            "kind": "file",
            "path": "assets/real-anton-07-excited-ideation.png"
          }
        },
        {
          "id": "anton.reluctantly-amused",
          "label": "reluctantly amused",
          "descriptor": {
            "valence": "comedic",
            "intensity": 2,
            "mouth": "slightly-open",
            "gaze": "to-camera",
            "headOrientation": "three-quarter-left",
            "gesture": "none"
          },
          "suitableFor": [
            "listening",
            "reaction"
          ],
          "flipSafe": true,
          "asset": {
            "kind": "file",
            "path": "assets/real-anton-08-reluctantly-amused.png"
          }
        },
        {
          "id": "anton.title",
          "label": "title-card portrait",
          "descriptor": {
            "valence": "neutral",
            "intensity": 1,
            "mouth": "closed",
            "gaze": "to-camera",
            "headOrientation": "three-quarter-left",
            "gesture": "none"
          },
          "suitableFor": [
            "titleCard"
          ],
          "flipSafe": false,
          "asset": {
            "kind": "file",
            "path": "assets/real-anton-title.png"
          }
        }
      ]
    },
    {
      "characterId": "veronika",
      "basePortraitId": "veronika.knowing-qualification",
      "entries": [
        {
          "id": "veronika.knowing-qualification",
          "label": "knowing qualification",
          "descriptor": {
            "valence": "neutral",
            "intensity": 1,
            "mouth": "closed",
            "gaze": "screen-left",
            "headOrientation": "three-quarter-right",
            "gesture": "none"
          },
          "suitableFor": [
            "speaking",
            "listening"
          ],
          "flipSafe": true,
          "asset": {
            "kind": "file",
            "path": "assets/veronika-01-knowing-qualification.png"
          }
        },
        {
          "id": "veronika.quiet-confidence",
          "label": "quiet confidence, raised finger",
          "descriptor": {
            "valence": "positive",
            "intensity": 2,
            "mouth": "slightly-open",
            "gaze": "screen-left",
            "headOrientation": "three-quarter-right",
            "gesture": "raised-finger"
          },
          "suitableFor": [
            "speaking"
          ],
          "flipSafe": true,
          "asset": {
            "kind": "file",
            "path": "assets/veronika-02-quiet-confidence.png"
          }
        },
        {
          "id": "veronika.active-explanation",
          "label": "active explanation, open hand",
          "descriptor": {
            "valence": "neutral",
            "intensity": 2,
            "mouth": "open-speaking",
            "gaze": "screen-left",
            "headOrientation": "three-quarter-right",
            "gesture": "open-hand"
          },
          "suitableFor": [
            "speaking"
          ],
          "flipSafe": true,
          "asset": {
            "kind": "file",
            "path": "assets/veronika-03-active-explanation.png"
          }
        },
        {
          "id": "veronika.title",
          "label": "title-card portrait",
          "descriptor": {
            "valence": "neutral",
            "intensity": 1,
            "mouth": "closed",
            "gaze": "to-camera",
            "headOrientation": "three-quarter-right",
            "gesture": "none"
          },
          "suitableFor": [
            "titleCard"
          ],
          "flipSafe": false,
          "asset": {
            "kind": "file",
            "path": "assets/veronika-title.png"
          }
        }
      ]
    },
    {
      "characterId": "roman",
      "basePortraitId": "roman.dry-interjection",
      "entries": [
        {
          "id": "roman.dry-interjection",
          "label": "dry interjection",
          "descriptor": {